26 febbraio 2017,10,Imbarranti e anche maleducati,"Qualche ora fa io, incinta di nove mesi e altre 2 amiche ci sediamo nei tavoli esterni del bar e chiediamo i menù. ci dicono che essendo domenica ci sono solo i 4 menù brunch da 25 euro. Dopo 20 min torna per farci ordinare e io, premettendo il mio stato e scusandomi per l inconveniente, chiedo se sia possibile escludere da uno dei menù le cose che in gravidanza non avrei potuto mangiare ed eventualmente abbondare con le porzioni con le altre rimanenti. Faccio una lista del menù giusto per far capire che quello che chiedo è una banalità. Il Menù era composto da : uova alla benedict, yogurt, frutta fresca, insalata mista, pane tostato, pan cakes e patate. Io potevo mangiare solo i pan cakes, le patate e le uova ma cucinate di più. Quindi eventualmente potevano mettermi uno dei mini pancakes in più o due patate...Lei acconsente e rientra. Dopo 30 min di attesa torna e mi dice che dalla cucina non accettano variazioni?! Di norma mi sarei alzata e me ne sarei andata ma Era un ora che eravamo sedute e volevo evitare il disagio alle mie amiche di aspettare ancora per mangiare. Dopo un altra mezz ora arrivano i piatti....nel mio c erano 2 pancake, tre fette di baguette e delle uova... richiedo almeno le patate (a quel punto erano le 3). Nel frattempo le cameriere uscivano frastornate con caffè e altro chiedendo in giro di chi fossero e altri tavoli si lamentavano del ritardo. Morale: finiamo ,ordiamo il quarto caffè (nei menù erano uno a testa, quindi uno in più) rinunciamo In due su tre ai dolci compresi nel menù e chiediamo il conto. 79,50 euro. Non solo abbiamo pagato il mio menù interno ma ci hanno anche addebitato il caffè;)! Se tutto questo fosse accaduto in un clima professionale e di gentilezza da parte dello staff probabilmente non starei neanche scrivendo questa recensione, ma la maleducazione, la svogliatezza e L atteggiamento di fastidio della cameriera hanno dimostrato ulteriormente che l attenzione al cliente è L ultimo degli interessi del locale."
26 febbraio 2017,40,Pranzo gustoso e leggero,Mercoledì ho pranzato al Pandenus e ho apprezzato una gustosa e allo stesso tempo leggera zuppa d'orzo ... l'ideale prima di una riunione di lavogo.
26 febbraio 2017,30,Aperitivo,"Siamo stati per un'aperitivo e non tutti i clienti vogliono l'happy hour. Questa è la nota negativa di questo e di mille altri locali di Milano. Servizio nella media, presentazione scarsa, conto esagerato. Abbiamo preso in due, io e mio marito , un primo giro, un crodino e una birra e poi un altro crodino con un 'altra birra. Siccome dovevamo temporeggiare per uscire a cena, non abbiamo toccato nemmeno una patatina.. Ci hanno fatto pagare 38 euro, come se fossimo stati in 4 a consumare un happy hour. Ci siamo sentiti presi in giro , non ci andremo mai più, in fondo è un panettiere che fa aperitivi ."
19 febbraio 2017,50,Brunch ottimo!,"Sinceramente non mi spiego tutte queste recensioni negative, la nostra esperienza è stata ottima! Il brunch è buonissimo e gli ingredienti di qualità. Nota di merito per non mischiare nel piatto dolce e salato ma dividerli in momenti diversi così da farti gustare meglio ciò che hai davanti. Io ho preso il piatto a base di pesce, con salmone uova strapazzate, crema di avocado, patate arrosto insalata e french toast. Tutto buonissimo. Anche il mio fidanzato è rimasto soddisfatto dalla qualità del bacon e delle uova. Prima del piatto vengono serviti un cestino con pane, fette biscottate e focaccia con marmellata, cioccolata e burro. Poi succo d'arancia e caffè. Infine un dolcetto che consiste in un mini brownie con panna montata, per niente stucchevole. Il posto è delizioso anche per una colazione, atmosfera rilassata e camerieri sorridenti. Insomma perfetto, ci tornerò volentieri"
7 febbraio 2017,20,Tutto molto male,Drink non eccelsi per il prezzo e buffet scarso. Servizio non cordiale. La cosa scandalosa è che prenotando si paga una maggiorazione sulle consumazioni
4 febbraio 2017,30,Colazione... senza sale.,"Frequento questo Pandenus occasionalmente dopo aver accompagnato mia figlia a scuola. Quindi presto alla mattina, verso le 8,15. E anche questa mattina come tutte le altre volte non trovo mai nulla che mi soddisfi: le cose salate ""devono ancora uscire"". Ogni volta. Ma organizzarsi per tempo anche per chi come me ama il salato no? Ho anche chiesto una centrifuga mela arancio e zenzero con molto zenzero. Lo zenzero non pervenuto. Non mi pare difficile accontentare una cliente che chiede cose semplici e un gusto deciso. Non credo che ritornerò."
1 febbraio 2017,40,Sempre gradevole,"Mi è capitato diverse volte di pranzare in questo posto. A mio avviso, la premessa è che non si tratta di un ristorante vero e proprio, comunque la qualità del cibo per me è buona, ho quasi sempre preso carne o pesce con verdure di accompagnamento e anche il rapporto qualità prezzo lo trovo interessante. Mi piace molto anche l'assaggio di pizza che portano in attesa delle pietanze. Oltre a questo, trovo che le persone che lo frequentano siano di un certo livello, dettaglio importante, per chi non ama pranzare tra schiamazzi esagerati o troppa confusione. In definitiva, un posto che tengo sempre presente come alternativa quando sono in zona."
29 gennaio 2017,10,Un pessimo brunch domenicale,"Tralasciando le considerazioni in merito al cibo di qualità medio/bassa e di certo non in linea con il costo del piatto (25 €), L'ambiente era decisamente pessimo. Camerieri tutti imbronciati anche mentre servivano ai tavoli, che discutevano tra di loro in mezzo ai clienti e pulivano i tavoli sbattendo le sedie e spruzzando detersivo incuranti del fatto che noi di fianco stessimo mangiando (tra l'altro con una bimba di tre mesi in braccio). Musica alta neanche fosse una discoteca. Veniteci al massimo a prendere il pane. Mai più."
17 gennaio 2017,20,Ma quanto mi costi?,"Il locale e' molto carino, io ogni tanto mi fermo a bere un caffe' a colazione. Oggi sono stata con amici che hanno ordinato un succo di arancia ( non una spremuta!) al bancone: 4 euro a bicchiere! Consigliato dunque per un caffe' o se disposti a pagare per la location"
15 gennaio 2017,30,Brunch!,"Leggo molte recensioni negative, ma devo dire che il nostro brunch non è andato così male. Certo, alcuni aspetti sono migliorabili. Partendo dal costo, ovvero 25€: va detto che a Milano è difficile fare un brunch spendendo meno di così e la quantità di cibo compreso nel menù è sicuramente adeguata alla cifra, anche se quanto meno una bottiglia d'acqua potrebbero includerla, visto che da bere c'è solo un bicchiere di succo e un caffè. Vero inoltre che nel menù era indicata un'insalata di spinacino, ma è arrivata normalissima lattuga. Il servizio è un po' lento, abbiamo dovuto attirare l'attenzione dopo una mezz'ora abbondante che avevamo finito con i cibi salati e attendevamo caffè e torta. La crema a base di avocado, a mio parere, sapeva troppo di limone, che copriva quasi completamente il sapore dell'avocado. I french toast erano gelati. Buono invece il salmone affumicato. Una menzione speciale anche per l'uovo alla benedict, davvero buono, anche se è arrivato gelato anche lui. Il dolce era buonissimo. Tutto sommato, un brunch soddisfacente, anche se migliorabile negli aspetti che ho indicato."
3 gennaio 2017,10,Colazione mancata,Cambiate per favore l'orario di apertura per la terza volta le 7.30 del mattino provo a d entrare per fare colazione ma niente locale chiuso e camerieri sempre più indisponenti bocciato senza neanche provarlo.
27 dicembre 2016,20,Brunch molto caro,"Il rapporto qualità / prezzo, specialmente considerando che è un brunch, è basso. Troppo caro per quello che offre"
16 dicembre 2016,40,merita una sosta,pranzo veloce ottimo e mai scontato sempre piatti nuovi e ben presentati. ottima poi la pizza bassa. una menzione a parte per l'ottimo caffè specialmente il marocchino preparato con maestria da Fabio. eccellente. ottima la varietà delle brioches alla mattina personale sempre disponibile e sorridente.
14 dicembre 2016,30,Bene ma non benissimo,"Buon brunch anche se un po' pesantino. Abbiamo atteso più di un'ora per ricevere quanto avevamo ordinato perché a quanto ci hanno detto ""abbiamo anche un tavolo molto numeroso appena arrivato da seguire"". Non credo che ci tornerò nonostante le ottime uova alla benedict."
27 novembre 2016,20,Anche no,"Abbiamo prenotato per il brunch. Locale carino. Punto. Non tornerò più perché : 1. Il servizio è molto carente; 2. Non è possibile mangiare in 4 in un tavolo da due; 3. La sera non avevo ancora digerito l'hamburger ( le patatine con pessimo odore di frittura sono rimaste nel piatto). Altrettanto onestamente ritengo che il ""coperto "" cioè pane e focaccine, sia davvero buono. Peccato."
21 novembre 2016,40,Buon brunch!,"Sono stata tre volte per il brunch con un'amica e ci siamo sempre trovate bene: sono assolutamente consigliate la prenotazione e la puntualità. Il personale è molto cordiale e gentile e sono disponibili 4 menù brunch a prezzo fisso tra cui scegliere, accompagnati da una selezione di panetteria e marmellate. Lo consiglio soprattutto in primavera ed estate per la possibilità di mangiare all'aperto."
12 novembre 2016,20,Costoso e cibo deludente,"Abbiamo fatto il brunch con la mia compagna. 25€ è veramente un prezzo ingiustificato rispetto alla qualità e quantità di quanto proposto nel menù. L'Hamburger che rilasciava acqua e senza sapore, l'insalata di spinacino in realtà era di lattuga. Nel complesso deludente. Il locale è carino in una bella zona, ma non lo consiglierei."
7 novembre 2016,50,Perché non trovo mia recente pubblicazione su Pandenus?? Grazie,"Cambio di guardia al Pandenus, Massimo il nuovo direttore ha dato da subito il suo imprinting al locale, valorizzando l' atmosfera già esistente e aggiungendo un tocco di classe ed eleganza. Basta guardare il nuovo assetto del bancone durante l""happy hour"": belle raffinate decorazioni punteggiano le golosità preparate dall' abile team che governa la cucina. Il tutto é reso ancora più piacevole dallo staff dei giovani sempre sorridenti e garbati che si destreggiano tra tavoli e clientela. Ottima la qualità del vino e dei creativi fantastici cocktail preparati dall'insostituibile Maurizio. Un grazie particolare va a Sara e Dario che ci hanno seguito la sera del mio compleanno !!! Ma di certo non aspetterò il prossimo per tornare nel miglior locale dell' Arco della Pace!!"
5 novembre 2016,40,Buono,"Siamo stati al Pandenus per il mio compleanno. Ero titubante per via delle recensioni negative ma devo dire che siamo stati bene. Buffet non molto fornito ma quello che c è è buono, i cocktail sono fatti bene e abbiamo preso una pizza (pagando 6€ a parte ma non mi pare eccessivo come prezzo). I gestori sono gentili. Da provare"
1 novembre 2016,20,Troppo rumore per nulla,"Devo dire che la location e ottima così come il brunch ,ottimi piatti e servizio altrettanto . Unica pecca al limite della sopportazione è il barista o addetto al banco ... ogni movimento che sia un piattino un bicchiere una tazzina un cucchiaino ,produceva un rumore infernale sinonimo secondo di poca accortezza verso il cliente . Detto ciò ( e la prima volta che mi capita , forse il barista e nuovo ? ),con dispiacere non frequenterò più questo locale"
31 ottobre 2016,10,Truffina,"In italiano esiste un sostantivo che definisce bene la mia esperienza in questo locale... Se Truffa è : Reato ai danni del patrimonio altrui eseguito mediante falsificazioni o raggiri, allo scopo di trarne profitto. Allora Truffina e' una crostatina a 5euro. Ovviamente era scritto sul menù e l ho scelta in piena consapevolezza. Ah... era ai frutti di bosco..."
31 ottobre 2016,10,Cambio gestione,"Ho frequentato per anni il locale, trovandomi sempre benissimo. Da quando hanno cambiato gestione, ci sono stata due volte a fare aperitivo. La prima volta dopo aver aspettato almeno una ventina di minuti che rifornissero il buffet, che ad inizio serata non dovrebbe già essere privo di cibo, ci è stato proposto di ordinare un tagliere di pizza (ovviamente da pagare a parte). Abbiamo rifiutato dal momento eravamo lì per prenderci un aperitivo, altrimenti saremmo andate direttamente in pizzeria. Dopo una lunga attesa è finalmente uscito del cibo dalla cucina, del quale siamo rimaste deluse, la qualità era infatti calata. La seconda volta, e anche ultima perché non penso tornerò più, avevamo prenotato originariamente per sei, arrivate lì alla fine eravamo in quattro, verso fine aperitivo ci raggiunge una quinta ragazza, la quale non aveva intenzione di ordinare nulla. Il cameriere ci fa presente che non è possibile rimanere al tavolo senza consumare, politica correttissima. Chiediamo allora, dal momento che stavamo occupando solo un tavolino da quattro e il locale era mezzo vuoto, se ci lasciano il tempo di far finire il drink ad una delle ragazze. Dopo aver acconsentito, lievemente contrariati, due camerieri sono rimasti in piedi, praticamente affianco al tavolo, a controllare e mettere pressione affinché finissimo in fretta e ce ne andassimo. Arrivate alla cassa per pagare, ci presentano un conto di 60€ (10€ a persona, per le 6 persone per cui si era prenotato in origine), abbassato a 50€ per ""gentilezza"". Volevano farci pagare anche per la ragazza che era rimasta seduta al tavolo per 5 minuti senza consumare nulla, cercando di farcelo passare anche come sconto degli originari 60€ dovuti alla prenotazione. Da che mondo e mondo non esiste che in un locale mezzo vuoto, dove il cibo per altro scarseggia venga, richiesto di pagare per la PRENOTAZIONE, per altro senza esserne stati minimamente messi al corrente prima. Alla fine, dopo lamentele e risposte scortesi da parte del signore in cassa, siamo riusciti a pagare 40€ (10€ a testa, prezzo per altro già più alto rispetto alla scorsa gestione)."
27 ottobre 2016,10,Cambio Gestione Deludente,"Sono molto dispiaciuta nel constatare che, dopo aver frequentato per anni il locale, con la nuova gestione non tornerò più.  Aperitivo: oltre ad un'offerta veramente scarsa, il servizio non è stato migliore. Prenotato un tavolo per sei ci sediamo in quattro, consumiamo e verso la fine ci raggiunge una quinta. Poichè la ragazza non ordina niente siamo freddamente invitate a liberare il tavolo, con la pretesa di dover pagare ben 60€ per la prenotazione iniziale, scesi a 50€ per rimediare alla consumazione non richiesta dall'ultima arrivata. (Dopo la discussione si giunge all'accordo di 10€ a testa, prezzo comunque aumentato rispetto alla precedente gestione). Ora, va bene richiedere la consumazione obbligatoria, ma non esiste al mondo il dover pagare per chi non c'è.  Peccato aver perso un bel punto di ritrovo."
23 ottobre 2016,20,Mai più il brunch qui,Poche parole: Il cibo è di scarsa qualità (sono stata malissimo poco dopo aver mangiato); il servizio è disorganizzato al massimo. Non vale la pena spendere 25€ per stare male. Piuttosto digiuno.
19 ottobre 2016,20,Pranzo speranzoso,"Sinceramente la sera prima avevo cercato un locale per pranzo proprio in zona Arco della Pace. Pandenus mi aveva incuriosito per il suo menù. Alla fine del menù non c'era nulla, anzi nemmeno il menù. Solo qualche piatto esposto tra cui scegliere. Opto per un hamburger, veramente piccolo e di scarsa qualità visto il costo. Locale nel quale non metterò più piede, peccato perché si presentava in modo eccellente."
4 ottobre 2016,10,Sempre peggio,"Vuoi per comodità o vuoi perchè il dehor è molto carino e si sta bene sono ritornata di nuovo, questa volta per il brunch, terribile, nel vero senso della parola. La qualità per il prezzo che fanno pagare è inaccettabile: hamburger cattivo, carne pessima da qui usciva tutta l'acqua, bacon con i pezzi duri di grasso, patatine fritte nell'olio vecchio (e si sentiva parecchio), pane raffermo, per 25 euro neanche spremono due arance ma ti danno un succo per giunta caldo. Per me è un no secco."
2 ottobre 2016,40,Brunch,"Grazie all'ingegno della mia ragazza, mi sono ritrovato in questo posticino molto carino, personale cordiale e cibo di qualità ci tornerò sicuramente. Bravi/e"
22 settembre 2016,10,MUFFA nella torta!,Abbiamo trovato abbondante muffa nella torta di mele. Assolutamente inaccettabile! Un controllo da parte dei NAS è probabilmente necessario
11 settembre 2016,10,Una tragedia totale,"Poche volte mi sono trovato davanti a così tanta incompetenza che mi dispiace quasi fare questa recensione perché è evidente che in cucina oggi c'era una persona che si improvvisava nella professione.  In sequenza, può sembrare una barzelletta ma è tutto vero: - ordiniamo i nostri piatti con uova alla benedict e di contorno standard propongono spinacino con altre verdure. Ci arriva un piattino di insalata iceberg, chiediamo spiegazioni e la cameriera dopo essere andata in cucina: ""lo spinacino non lo mangiava nessuno e lo abbiamo tolto, i menù sono ancora vecchi"". E questo è solo l'intro... - le uova alla benedict sono arrivate FREDDE da frigorifero, tutte!! Sorpresi chiamiamo la cameriera e le facciamo rifare. - tenetevi... Ci hanno riportato le stesse uova scaldate al forno!!! Le benedict sono diventate sode!! Quelle rimandate in dietro e magari assaggiate prima di accorgersi che erano fredde - le hanno riportate così, con il pezzo mancante!! - ci facciamo chiamare il cuoco, si presenta una signora che ammette anche di avere scaldato al forno le uova ma sorpresa dice:"" se volete le rifaccio"" - ci riportano le uova, nel mentre il bacon che le accompagnava si era perso da qualche parte, e sono ANCORA FREDDE!!! Da lì sono seguiti una serie di mancanze che a questo punto è anche inutile raccontarvi.  Non cucinate se non siete capaci!!! Fate due cocktail e due pizzette e via così...  Voi che leggete - non andateci mai!!"
4 settembre 2016,40,Brunch domenicale,"Siamo stati per un brunch domenicale: abbiamo telefonato per prenotare al mattino, senza problemi ci hanno trovato posto per la fascia delle 13:30. Il locale ha posti sia fuori, sia dentro: ben arredato, piacevole anche come bar o come aperitivo. Per il brunch danno possibilità di scelta tra 4 menù, tutti a 25€ l'uno: americano, francese, inglese e tedesco. Nell'americano che ho preso hamburger molto buono, uova davvero eccellenti (un consiglio, non prendete le classiche occhio di bue, le altre sono super!!!), anche il burro e la marmellata di entrata davvero buoni, nota stonata la crema di nocciole. Anche l'inglese ottimo, con pancake e macedonia con yogurt. Personale molto gentile e davvero al tuo servizio, non fanno mancare nulla. Per chi vuole il brunch a buffet, rimarrà deluso, ma come brunch in se davvero uno dei migliori di Milano per bontà e qualità."
1 settembre 2016,40,Posto carino per il brunch,"Posto molto carino per fare colazione/ brunch. Anche alla sera fanno pizza al metro molto buona! Ingredienti di qualità e freschi, consigliatissimo! Ps vendono anche il pane che fanno loro buonissimo!!!"
9 agosto 2016,50,Ottima colazione,"Buonissima la colazione con tante varieta di brioches, Buone anche le centrifughe e le numerose torte a disposizione Per chi vuole qualcosa di salato sono da provare i mini panini"
30 giugno 2016,40,Tutte le mattine una colazione deliziosa,La colazione al pandenus e' decisamente deliziosa ed il cappuccino di Fabio un vero cappuccio la scelta di dolci ottima e l'ambiente bello e rilassante irrinunciabile!!!!
28 giugno 2016,40,Vuoi non andare da Pandenus?,Pandenus è stato una scoperta meravigliosa e golosa! Da Milanese Imbruttita metterò nella lista dei locali Pandenus. Ho preso una tortina ai frutti di bosco deliziosa e la mia amica una cotoletta alla milanese con patate e una salsa molto buona. Ritorneremo sicuramente perchè a qualsiasi ora del giorno si trova qualcosa che delizia il palato.
13 maggio 2016,30,corente,"un posto gradevole , per un aperitivo rinforzato mi è sembrato ottimo , buona la pizza e i tabule , buona scelta di vini......unico handicap la musica troppo alta"
24 aprile 2016,50,Sorpresa,"Ci solo stato con degli amici totalmente a caso. L'ambiente è molto smart e accogliente, siamo stati accolti dal proprietario che ci ha fatto sentire come nel salotto di casa nostra.. Ho mangiato un hamburger e una tartar di manzo, che è stata la sorpresa della serata, deliziosa, mai mangiato un piatto così buono. Unica nota di colore: avevano finito le patate come contorno (colpa anche nostra che siamo arrivati tardi)... Consigliatissimo! Ci tornerò!"
22 aprile 2016,40,Un aperitivo fuori dal comune!,"Aperitivo all'interno di un panificio, di conseguenza tra le pietanze disponibili la fa da padrone la focaccia, di tutti i tipi. Da provare!"
19 aprile 2016,40,Brunch buonissimo,"Con 20€ ho fatto un brunch con le mie amiche fantastico, c'è di tutto il piatto è enorme! Meglio prenotare telefonicamente."
10 aprile 2016,10,Maleducati è dir poco!,"È la terza volta che vado, due volte per colazione e oggi per fare un brunch. Già a colazione avevo notato la cafonaggine del personale, e l'attesa per un cappuccino e una brioches sproporzionata al fatto che il locale fosse vuoto. Oltre al fatto che il cappuccino fosse pessimo! Oggi, locale vuoto, ore 12,35, ci hanno detto in malo modo che poi c'era il turno della 13,30 e che quindi non avrebbero portato niente da mangiare per noi! Va beh... Allora lascialo vuoto il locale, se sei più contento! Tutto proprio maleducati... Ma tutti!"
8 aprile 2016,20,BRUNCH,"Sono stata per il brunch della domenica con amici e il locale e l'organizzazione sono decisamente da bocciare. Avevamo prenotato con preavviso e ci siamo ritrovati un tavolo troppo piccolo per undici persone: per riuscire a starci e mangiare abbiamo dovuto usare le posate a turno perché due persone contemporaneamente non potevano farlo, tanto eravamo attaccati l'uno all'altro. Abbiamo chiesto più volte al personale di unire un altro tavolo o aggiungere almeno una sedia, e la risposta era da parte di tutti la stessa ""non sono io il responsabile di sala; vi chiamo il ragazzo che se ne occupa"", chiaramente il soggetto in questione non é mai arrivato per risolvere il problema. Per quanto riguarda il brunch in sé, questo é composto da 4 diverse opzioni di menù abbastanza varie. La qualità non é al top, ma comunque nulla di immangiabile insomma. Il fatto é che il prezzo minimo é di 25 € e per le bevande comprende solo un bicchiere di succo, perciò inevitabilmente si spenderà di più, a meno che non si voglia morire di sete. A quel prezzo tanto vale fare un pranzo fatto bene allora!"
4 aprile 2016,40,Non male.....,"Di passaggio zona laterale corso sempione/ arco della pace, ho deciso di provare la cucina del Pandenus. Bhè io ho provato una vellutata di ceci e gamberi non affatto male, il sapore intenso e il gusto forte non hanno fatto che farmi apprezzare il piatto, accompagnato da dei crostini, l'unica pecca che ho constatato è stata l'elevata sapidità di sale, un pò eccessiva! Complimenti vanno fatti allo staff, davvero dinamico e gentile.... Davvero Bravi, continuate così!!!"
3 aprile 2016,10,PESSIMO????,"Cosa dire di un locale che lavora molto bene in qualsiasi orario della giornata? Magari con un dopocena tranquillo,ma con un' aperitivo che lascia contenti svariati tipi di persone. Forse, le uniche persone scontente sono proprio quelle che non si sanno comportare o che pensano che: ""Siccome sono il cliente..posso decidere come,cosa,quando,se e perché. "" Giro molti locali ma non è mia abitudine recensire in quanto persona semplice ma senza diritto di sparare sentenze senza capire il perché delle cose. Mi rivolgo a te che recensisci con un titolo "" VOJA DE LAURÀ SALTEM ADOSS"". Ero proprio lì..vicino a voi.. Alla stessa ora ho cenato e bevuto il mio caffè.. Ho anche visto come lavorano questi ragazzi..probabilmente dovreste andare a bere nei posti dove veramente vi trattano male per capire la differenza..Peccato che lo stesso personale non possa rispondervi in quanto non concesso se non al titolare. Sarebbe bello ogni tanto sentire anche l altra versione..e non solo persone come te..che ti permetti di decidere cosa è giusto o sbagliato. PESSIMO??? SI..FORSE QUESTO TIPO DI CLIENTE!!! Forza ragazzi, Siete una grande squadra!!!! non badate a chi,bevendo un drink in una sera intera si permette di criticare.. quelli sono clienti che nessun locale vorrebbe!!! ;)"
3 aprile 2016,10,Maleducati soprattutto.,"Lasciando stare che dopo averci avvisato che stavano per chiudere il buffet ""purtroppo"", hanno tolto tutto nel tempo che ci sedessimo, e vabe, poco carino, poteva farci almeno fare un piattino. Zero proposte vegetariane, abbiamo chiesto un club sandwich togliendo la carne o un hamburger senza hamburger (non pretendevamo granchè) e ci hanno risposto che non si poteva fare (cosa che abbiamo fatto da sole, senza nessuna laurea specifica). Dopo averci chiesto se volevamo le patatine insieme al club sandwich, ho chiesto se era possibile avere una porzione di patatine e la risposta è stata ""avete sbagliato posto"". Why?! Per concludere abbiamo chiesto un panino che era al banco in vendita e ci hanno specificato che ""ce lo dovevano far pagare""... Grazie al cavolo -.- nessuno aveva pensato di non farlo. Dulcis in fundo: ordino un secondo cocktail e me ne fanno un altro ps. Il posto è in mezzo al niente!"
3 aprile 2016,20,Un tempo era molto meglio,"Un tempo la qualità era molto superiore, all'aperitivo continuavano a sfornare teglie di pizze e focacce fresche, ora si sono uniformati a tutti gli altri aperitivi a base di cous cous e carote crude e pizza stantia. Morale dov'è il valore aggiunto? Di sicuro i prezzi non si sono abbassati però."
