13 luglio 2018,50,Aperitivo,"Eccellente!! Vini di alta qualità e personale delizioso, attento e professionale! La qualità si paga ma certo il bicchiere di Muller che ho bevuto qui è allo stesso livello di quello del Trentino! Bravi e buoni! Meglio un aperitivo non tutte le sere ma di qualità! Grande Staff ! Roberta Moro"
10 luglio 2018,20,Deludente,Aperitivo di lunedì sera. Locale semivuto buffet veramente triste. Due tipologie di insalata di riso e cous cous con lo stesso sciapo sapore il resto del buffet misero nulla di che. Peccato!
9 luglio 2018,10,Il peggior posto di milano,"Sembra non abbiano idea dei prezzi. Chiedono cifre astronomiche per un bicchiere di vino di scarsa qualità. A me hanno chiesto 12 eur per un bianco quindi per due 24 eur, non dico altro. Camerieri incompetenti su tutto. Cibo scarsissima qualità. Chi vuole andare vada pure, io mai più"
7 luglio 2018,30,Un pranzo anonimo,"Carino e invitante, pranziamo con un amica per la prima volta al pendenus. Ci ero stata qualche volta per aperitivo e colazione (ok!). Nulla entusiasma. Piattini pronti che vengono scaldati al microonde. Prezzi alti come ovunque in zona. Non mi ha convinto per il pranzo ...in zona c’e’ di molto meglio."
27 giugno 2018,50,Il risveglio mattutino!,"Locale molto bello, accogliente, con personale amichevole che ti rallegra la giornata. La qualità dei prodotti è molto buona. Consiglio per una buona colazione e un brunch. La serata meravigliosa con stupendi cocktail. Consigliatissimo!!!"
26 giugno 2018,20,PANDENUS GAE AULENTI - PESSIMO,"Non essendoci Pandenus di Gae Aulenti recensisco qui la nostra esperienza passata là. Eravamo un gruppo di 10 persone e, non avendo accettato una ns prenotazione telefonica, ci siamo presentati al locale cercando un tavolino senza tante pretese (alle 20). Ci offrono appunto un tavolino con 2/3 sedie proponendoci di passarcele man mano che la gente si alzava. Così accettiamo e dopo un’ora eravamo seduti in 7, e 3 bevevano in piedi. I camerieri infastiditi dalle nostre richieste nel chiedere delle sedie che ormai erano vuote (ci dicevano che arrivava gente e non potevamo). Detto questo parliamo dell’ “aperitivo”.... dunque la formula prevede 12€ a bevuta, ma si presuppone che ci sia poi un aperitivo... beh a noi il cameriere si è scusato dicendoci che le alzatine con la pizza non era sicuro arrivassero ma che ci sarebbero state “tante olive”. Wow, che delizia! ... olive portate n.6 , alla fine portata pure alzatina con n. 8 quadratini 3x3cm di pizza (ricordo che eravamo in 10). Che dire, un disastro. Do 2 punti e non 1 solo perchè hanno avuto la decenza di non farmi pagare 12€ la coca cola, ma un locale serio a) non avrebbe mai permesso un trattamento simile b) avrebbe offerto o si sarebbe comunque scusato per l’accaduto. Così non è stato, pertanto eccomi a scrivere."
24 giugno 2018,10,Gae Aulenti da evitare..,"Provato Gae Aulenti, location a parte, Aperitivo pessimo..caro e inesistente! 9 euro una birra 3 pezzi microscopici di focaccia! Non si commenta"
7 giugno 2018,20,Aperitivo scarso,Buffet per l’aperitivo abbastanza scarso. Durante l'orario di aperitivo la consumazione 10 euro. Il menù ha una decina di cocktail e niente più. Praticamente seduto a bordo strada di fianco all'auto parcheggiata ed al viale trafficato. Non credo che tornerò
1 giugno 2018,10,Da evitare,Posto assolutamente da evitare. Il più caro di Milano senza averne le qualità. Due bicchieri di vino bianco fermo 24 euro e un buffet scarso. Mai più
31 maggio 2018,10,Il peggior locale di Milano,"Oltre ad avere un buffet per l’aperitivo davvero triste e con ingredienti vecchi,abbiamo preso in 2 persone, 9 bicchieri di vino e ci hanno portato un conto di 90 euro! Capisco pagare la prima consumazione 10 euro, ma le altre?!? O almeno farci pagare 2 bottiglie e non a singola consumazione...davvero incredibile!!!! Mai mai mai più!"
23 aprile 2018,50,Assolutamente consigliato,Pizza deliziosa e servizio eccellente Uno dei migliori aperitivi di Milano Inmancabile appuntamento con gli amici!
21 aprile 2018,20,Pessima organizzazione e scortesia,"Poiché consigliato da un'amica sono andata un sabato sera a fare un aperitivo, entriamo per chiedere un tavolo e ci dicono di aspettare una mezzora. Noi però vediamo un tavolo libero fuori senza sedie e chiediamo se ci possiamo sedere e chiediamo se ci possono dare delle sedie e ci rispondono che non ce ne sono più nonostante all'interno ce ne fossero molte, allora abbiamo dovuto prendere noi la decisione di spostare le sedie, ordiniamo e andiamo a prendere il cibo, molto buono devo dire, ma i drink non arrivavano mai , entro a chiedere e il barman si rivolge in modo scortese e scocciato. Purtroppo se fossero meglio organizzati e più gentili sarebbe tutto un altro locale."
8 aprile 2018,50,Ottimo brunch domenicale,"Ottimo posto per un brunch domenicale, propongono 4 menù molto interessanti e aperti a modifiche. Porzioni davvero abbondanti e buona qualità. Forse un po' costoso, ogni menu 25€."
7 aprile 2018,10,Al conto ho dato 1,"Unica nota positiva, così ce la togliamo: locale carino (purtroppo invoglia ad entrare).  Entro con due amici per un bicchiere di vino dopo cena:  Innanzitutto il servizio è allucinante, palesemente gestito da gente che non ha interesse che il posto vada bene; tempo due secondi da quando ti siedi e senza nemmeno portare un menu il cameriere inizia a mettere l’ansia per far ordinare (nonostante il posto sia vuoto quindi non mi spiego la fretta); alle 23, con il locale che chiude all’1, iniziano ad apparecchiare per la colazione anche sui tavoli occupati e a pulire in giro.  Verso le 23 e 30, dati i vari messaggi subliminali che cantano all’unisono “fuori dai c...”, paghiamo: ora, a me piace il vino e sono disposto a pagare 7,50€ per un calice ma: - primo: non per un Chianti assolutamente normale - secondo: se devo pagare un prezzo fuori mercato voglio averlo letto prima dalla carta dei vini"
6 aprile 2018,10,Prezzi folli e scortesia,"Ci torno ogni volta e ogni volta mi maledico. Il locale vuoto il venerdì sera all’arco della pace dovrebbe fare capire ai gestori che trattare a pesci in faccia i clienti non paga.  [Siparietto. Io: Scusi, quanto viene uno spritz? Cameriere1: oh, quanto viene uno spritz a quest’ora? Sei? Sette? Cameriera2: Nove!]  [[Ah, spritz terribile]]"
4 aprile 2018,30,Post cena,"Siamo venuti qui dopo cena e abbiamo preso qualche birra e qualche fetta di torta (lamponi e cioccolato fondente, buona). I prezzi sono sopra la media, ma il locale e' in centro a Milano... Il locale e' tranquillo e il servizio e' buono."
26 marzo 2018,10,Pessimo servizio! Mai più!,"Non entro nel merito del cibo, discreto, ma il servizio è veramente da rivedere! Siamo state domenica per il brunch e dopo averci messo fretta per ordinare, in malo modo ed insinuando che non avremmo fatto in tempo visto che dovevamo lasciare il tavolo alle 13.30 ed erano già le 12.15 (10 minuti di ritardo nostro e altri 3-4 minuti per andare in bagno dopo la stramilano) e prima di noi aveva appena ordinato un tavolo di 22 persone (come se fosse un problema o meglio, colpa nostra!!) e le ordinazioni sarebbero andate per le lunghe. Inoltre su 5 persone 1 di noi non ha preso il menù brunch ma solo una fetta di torta presente nel menù proposto tra l'altro ed è stata ripresa- in malo modo- perchè alla domenica ci si può sedere solo se fai il brunch e che quindi avrebbero potuto assegnarci un tavolo più piccolo. In tutto questo abbiamo dovuto sollecitare più volte noi le cameriere per ricevere le bevande, il caffè e il dolce finale ma alle 13.30 ci hanno chiesto, sempre con molta gentilezza...di alzarci, rimasti in fila per quasi 15 minuti alla cassa per pagare il locale è rimasto vuoto... Rimango sbalordita quando vai in un posto e paghi e vieni trattato come se stessi facendo un dispetto..."
13 marzo 2018,40,Aperitivo goloso e curato,"Posticino accogliente, drink ottimi (vasta scelta anche x i cocktail analcolici), aperitivo goloso, tra polpettine di carne,pizza fatta in casa sfornata in continuazione, verdure, affettati, salsine stuzzicanti. L'impressione è che sia molto curato. Torneremo sicuramente!consiglio:prenotare x trovare posto!!!"
6 marzo 2018,50,Buon Brunch in centro a Milano,"Sono stata qui per un brunch domenicale con amici. Leggendo le recensioni ero un po' titubante, ma mi sono ricreduta: il personale è gentile e disponibile, il locale particolare e curato nei dettagli. Le opzioni di brunch sono quattro, tutte molto abbondanti anche se a un prezzo non molto economico, ma è un menu che sazia davvero, quindi il gioco vale la candela! Consiglio la prenotazione, e se riuscite scegliere, per la domenica, la fascia oraria 12.00-13.30. Lo consiglio!"
4 marzo 2018,40,Brunch buono,"Ho provato il brunch in questo locale, e l’ho trovato molto buono e abbondante. Sinceramente non capisco le recensioni negative, infatti sono andata lì prevenuta, ma alla fine ne sono uscita sazia e soddisfatta. È caro, ma comunque considerando quantità e qualità del cibo ci può stare.. Lo consiglio!!"
4 marzo 2018,40,Pulito ed accoglientr,"Posto molto pulito, con vetrine brillanti...mi.invogliava molto ad entrare, cosi ho provato ed ho bevuto un ottimo caffe d orzo e una brioche molto genuina. Nn ho provato il salato..ma penso lo faro prox occasione."
25 febbraio 2018,10,Terribile!!!!,"Esperienza a dir poco negativa, abbiamo prenotato un tavolo per un brunch domenicale alle 13'30, il locale alle 13'25 ci chiama dicendo che hanno circa mezz'ora di ritardo. Alle 14'30 ci dicono di accomodarci in un tavolo improponibile per il numero delle persone prenotate. Dopo la ns richiesta di un tavolo piu grande,ordiniamo e arriva il cibo x le 15.20. Hamburger crudo nonostante avessi specificato alla cameriera che era per una donna incinta! Tutto organizzato malissimo, personale poco cortese e totale da pagare illegale per quello che ci è stato portato."
14 febbraio 2018,50,"Bravi, simpatici, educati.","Si, sono bravi, simpatici e da non sottovalutare l'educazione, dote che spesso in un certo ambiente milanese è stata sostituita dalla cafonaggine. Ottimo aperitivo con pizza sfornata al momento, patatine home made e ottimi drinks. Ambiente rilassato chic e non da vittime dell'apparire. Raccomandato !"
2 febbraio 2018,10,PESSIMO DA EVITARE IL POMERIGGIO / PRE APERITIVO,"In una delle zone più belle di Milano un locale come PANDENUS dovrebbe evitare di avere un servizio pessimo e non all’altezza dei prezzi. Faccio questa recensione perché l’educazione e la gentilezza verso i clienti sono indispensabili! Due episodi, entrambi molto sgradevoli negli unici due pomeriggi in cui abbiamo scelto PAMDENUS per una pausa. Ottimo invece il servizio e la gentilezza per la colazione della mattina! Sono inoltre meravigliato di come il responsabile / referente del locale presente non abbia mosso un dito per porgere le opportune scuse o dare spiegazioni."
18 gennaio 2018,30,Aperitivo in una cornice proprio carina,"Non è il luogo dove andare aspettandosi una mega happy hour come nella maggioranza dei locali milanesi però è carino. Il locale è una piccola perla, arredato con gusto e sempre ordinato. I ragazzi che lo gestiscono sono perfettamente in grado di presentare piatti e bevande mostrandoti il loro ""lato migliore""! Sui drink non c'è nulla da eccepire: sono perfetti! Non è proprio a buon mercato ma direi che la location vale la candela. Sono tornatra più volte, per affari, con amici e mi sono sempre trovata bene. Lo consiglio"
10 gennaio 2018,10,DA EVITARE,"Passi per caso e sembra carino e accogliente , ma mai entrarci . Non sono assolutamente uno da complain facile ma questo posto merita assolutamente il dissenso. Un cocktail minuscolo, aperitivo scarso e bambini che urlavano e prendevano da mangiare come se non avessero mai visto del cibo. Il servizio assolutamente freddo e poco raccomandabile. Il proprietario o colui che stava alla cassa molto indisciplinato e soprattutto se chiedi perché hai fretta non puoi fare aspettare 20 minuti perché devi parlare alla cassa. Capisco la voglia di confidarsi con gli amici, ma quando sei di fronte ai clienti devi prestare attenzione. Non consiglio in nessun caso e mi dispiace perché la location sarebbe top . Ma non è tutto oro quello che luccica. Buona fortuna per tutto."
9 gennaio 2018,40,Bella atmosfera,"Il locale è carino ed intimo con una bella atmosfera ed ottima musica di sottofondo. Buoni sia i cocktail che i vini, aperitivo non troppo ricco ma gustoso. Personale molto simpatico, attento e discreto. Considerando la zona i prezzi si possono considerare nella media."
31 dicembre 2017,30,Aperitivo buono ma troppo caro,"L'Aperitivo è molto buono e la location davvero bella. Ho dato solo 3 stelle perché il costo è davvero esagerato. Tutte le ordinazioni sono a prezzo pieno. Non viene applicato alcun ribasso alla seconda, terza (etc) ordinazione presa dalla stessa persona. 3 birre a 30 euro in poco più di 1 ora è mezza!"
29 novembre 2017,40,GENTILEZZA TOP!,"Di solito scrivo recensioni dopo aver testato almeno la cucina di un locale ma in questo caso farò un eccezione. Sono arrivata al locale alle 23.15 pensando restasse aperto fino a tardi, volevamo solo bere un drink, il ragazzo che ci ha accolto ci ha fatto presente che avrebbero chiuso alle 23.30, vedendo la nostra perplessità e vedendo la serata di pioggia, molto carinamente ci ha detto che avremmo potuto restare all'interno fin dopo la chiusura mentre loro, nell'area area del locale avrebbero iniziato a pulire. Decidiamo di fermarci. Alle 23.30 anche senza aver finito il nostro drink ci siamo alzati per togliere il disturbo ma lo stesso ragazzo ha continuato ad asserire che avremmo potuto restare senza problemi. Per quando mi riguarda, l'essere accolti con questa passione e gentilezza, vale più di tutto.. Tornerò sicuramente per aperitivo/cena. Grazie davvero al cameriere con un leggero accento straniero. Ho apprezzato davvero tanto."
17 novembre 2017,10,Triciclo vestito da Ferrari,"Metti una sera a Milano, metti la voglia di un buon calice bollicinoso dopo cena, metti quel nome accattivante e commercialmente azzeccato (Pandenus) e zac ti ritrovi seduto ad un tavolino interno ad ordinare. Bollicine, grazie. Non ne hanno molte ma il Ferrari c’è e fa sì che ti senta sicuro di una buona qualità. Un calice, quindi, magari anche un pochino abbondante. Le portiamo anche qualcosina di aperitivo da stuzzicare? Aperitivo alle 22? No grazie. Pochi avventori nel locale, d’altronde è un giovedì sera novembrino. Sarà quindi che l’incasso langue ma, alla richiesta del conto, la signorina alla cassa cala il jolly: 20 euro! 20 euro per un calice, magari appena un po’ abbondante? Ti guardi intorno ma la realtà è che sei in una qualsiasi via di Milano, non sull’altare del Duomo... Indispettita, la signorina ti rimanda al responsabile che appare dopo qualche minuto (eh beh, i clienti fastidiosi meglio farli aspettare...) con quel piglio di simpatia portami via... Queste sono le nostre regole, dice, spiegando che per loro un calice equivale a mezzo sorso umano, forse uno intero canino. Il culmine della professionalità lo raggiungono proponendoti un ultimo assaggino offerto con estrema magnanimità. Anche no, arrivederci anzi addio."
12 novembre 2017,40,Domenica originale,"Oggi siamo stati da Pandenus per un brunch, ci siamo trovati molto bene i quattro menù proposti sono particolari e ben fatti, c'è anche un menù per i bambini... I prezzi non sono particolarmente economici, ma accettabili. Il personale è stato molto gentile: la cameriera che serviva il nostro tavolo quando ha finito il turno ci ha salutati☺☺. Ci torneremo sicuramente!"
5 novembre 2017,40,Sempre una buona scelta,"A due passi dall'Arco della Pace, Pandenus in Melzi d'Eril si rivela essere sempre un'ottima scelta per il momento aperitivo. Drink a prezzi normali (dagli €8 ai €12 circa), buoni sia i classici sia quelli proposti nella lista speciale. L'atmosfera è piacevole, lo staff abbastanza adeguato (migliorabile). Ad accompagnare la serata ci sono buonissime proposte a buffet (fino alle 21:30 circa): pizza (quella sottile con la rucola a mio parere è deliziosa), insalate di cereali vari, verdure, polpettine di carne, bruschette e patatine. Tutto buono. Lo consiglio sicuramente per una felice esperienza!  Inoltre è possibile ordinare piatti dalla carta, comprare delizioso pane fresco e dolci di diverso tipo."
17 ottobre 2017,40,"Carino, nella media","Non conoscevo il locale mi ci ha portato mia figlia. Ho provato l'offerta brunch che nelle sue 4 varianti è interessante. Se ti fanno accomodare in 4 su un tavolino sei abbastanza scomodo perché i piatti occupano tutto lo spazio. Abbastanza ""centellinata"" la disponibilità dei succhi. Ottimo il servizio"
12 ottobre 2017,20,Da evitare,"Piccolo locale con tavoli ammucchiati, pochi piatti disponibili , servizio frettoloso e distaccato, prezzi elevati, cibo nella media."
3 ottobre 2017,50,Ottimo,"Ho letto le recensioni di questo locale e non sono assolutamente d'accordo con ciò che dicono in molti.ho dormito in un beb in zona e sono stato per quattro giorni sia per la colazione sia per il pranzo,ho trovato ottimi piatti,ottimo cappuccino e personale molto simpatico,Emanuela è una ragazza dolcissima ,andate a scoprire pandenuse non ve ne pentirete"
3 ottobre 2017,50,Aperitivo di compleanno,"Siamo stati ieri per un aperitivo di compleanno. Ci hanno riservato una zona e tutto è stato perfetto. Il locale è molto gradevole, cibo e vino ottimi e il personale di grandissimo livello. Grazie! Una bella serata!"
2 ottobre 2017,40,Brunch,"Proposte molte carine per il brunch. Ci sono quattro proposte diverse, tutte servite in un vassoio. Ti portano subito diversi tipi di pane con burro, marmellata e nutella. Io ho scelto la proposta con il salmone e i gamberi. C’è anche l’insalatina, le uova, una salsa all’avocado, dei toast, il succo, la tortina al cioccolato e il caffè. Tutto ottimo. Servizio molto carino. Posto bello. Prezzi giusti ( euro 25, tutto compreso ) Non è il massimo vedere i camerieri che corrono. Forse quando il locale è tanto pieno ci vorrebbe una/due persone in più a dare una mano."
1 ottobre 2017,10,Delusione (delusione reale),"Siamo arrivati li per un club sandwich e ci hanno obbligato a fare il brunch. Pessima esperienza. Dopo un'ora di attesa (ora reale) arriva il brunch che è stata una mediocre colazione all'inglese. Non abbiamo gradito nulla di quello che comprendeva il menu. La cosa piu spiacevole è stata far notare il Bacon carbonizzato (carbonizzato realmente), si sono scusati ma non lo hanno sostituito. Salviamo dalle critiche caffè e succo di arancia e la simpatia delle ragazze, che malgrado tutto ci hanno strappato un sorriso. Non sufficiente per tornarci."
18 settembre 2017,10,Maleducazione e poca attenzione al cliente,"Siamo stati da Pandenus alle 11.40 di domenica scorsa, per una tarda colazione, 5 adulti e due bimbi. Trattati con maleducazione e sfrontatezza perché avremmo utilizzato un tavolo per una ordinazione irrisoria rispetto al possibile brunch che avrebbe portato al locale ""300 euro al posto di pochi euro"" per dei cappuccini e dei muffin. Con le cameriere che si chiamavano per sapere se potevano venderci il salato come se fosse una colpa perché dovevano buttarci fuori in tempo per i preziosi ospiti del brunch, perché avrebbero avuto sgridate dal capo per aver accondisceso dei clienti. Posto che il locale era vuoto, posto che se prendo un cappuccino e una briosche quanto pensavano saremmo rimasti, credo che un cliente abbi pari dignità, e che la freddezza e il modo con cui siamo stati accolti denoti un disinteresse a far tornare dei clienti. Non ne avranno bisogno, ma se mi capitasse di fare dei brunch da 300 euro, state sicuri che non andrò da Pandenus."
8 settembre 2017,10,Poco spazio... poco cibo,"Sono stata a fare un aperitivo con delle amiche... innanzitutto ci hanno messo in un tavolo dove eravamo strettissime, io per potermi alzare (siccome la panca era in comune con una di un altro tavolo) dovevo scavalcare la panca all'indietro... fino a che non si è riempito anche il tavolo dietro e a quel punto ero bloccata. Sul bancone quattro cose in croce... continuavano a portare solo pezzi di pizza. Le cameriere appena finito il cocktail continuavano a chiedere insistentemente se prendavamo altro... per liberare il tavolo. A quel punto ce ne siamo andate e di sicuro io non tornerò mai più."
23 luglio 2017,10,Record,"Scelgo uno dei coktail in lista , doveva essere una variante dello spritz, mi e'arrivato una cosa tipo succo ace con ghiaccio , servito in un bicchiere mignon , c'e' un limite anche per le prese in giro....."
21 giugno 2017,30,Nulla di chè....,"Lo staff è veramente scontroso, e scordati di fare un brunch con calma - ti buttano fuori appena finisci per il prossimo cliente. Il cibo non è buonissimo. E posso dire che il brunch al Americana non è US Style, ma Italian style. Però se ti piace andare in un locale dove vedi tanta gente che vuole essere ""vista"" questo è il locale per te."
31 maggio 2017,10,Ladri,"Abbiamo preso un caffè ed attratti da una brocca di the freddo sul bancone ne abbiamo presi due bicchieri. Era caldo e per niente gradevole. Abbiamo segnalato la cosa e ci hanno detto che doveva arrivargli la brocca con il ghiaccio ancora. Ci hanno fatto pagare 3,50 Euro a bicchiere!!!! Siamo senza parole. Quando abbiamo chiesto se davvero costasse così questa bevanda inconsumabile ci è stato detto semplicemente si."
17 maggio 2017,10,Pessima scelta,"Il più caro è pessimo brunch che io abbia mai fatto! Posto carino ma servizio pessimo, tutti molto scortesi. Piatti con prodotti di scarsa qualità, con 25€ dovete almeno fare una spremuta fresca non un semplice bicchierino di succo di arancia! Se posso darvi un consiglio scegliete un altro posto peggio di così a un costo così alto non si può trovare!"
16 maggio 2017,50,Colazione,"Locale molto carino, il pezzo forte sono le briosche , ottimo anche il caffè. Se vi piace fare la colazione seduti è il posto giusto."
14 maggio 2017,20,Non vale il prezzo,"Siamo venuti a fare un brunch domenicale in amicizia e ne siamo usciti delusi. Non è un problema di quantità ma di qualità prezzo. 25€ a testa secondo me devono garantire certi standard di qualità e di servizio. Il personale deficita di cortesia, in 8 persone siamo stati compressi in due tavolini nonostante avessimo prenotato. Chiarisco.. non abbiamo mangiato male ma ho fatto brunch migliori spendendo 16€."
1 maggio 2017,30,Ottimo brunch,Ottimo brunch con scelta tra 4 menu finalmente diversi tra loro. Il cibo è decisamente di buona qualità e i prezzi ottimi per essere in centro a milano. Zona molto bella un po scomoda per il posteggio.
9 aprile 2017,10,Disservizio,Dopo dieci minuti di attesa la responsabile ai tavoli era in sbattimento per la disposizione dei tavoli. Non siamo stati presi in considerazione dopo tanta attesa ce ne siamo andati. La responsabile e molto disorganizzata dovrebbe cambiare mestiere
9 aprile 2017,40,Ottimo aperitivo,Sono stato con molti colleghi di lavoro a questo locale vicino all'Arco della Pace e ci siamo trovati molto bene. Aperitivo classico con buona qualitá del cibo e cocktail. Da segnalare buoni prezzi per le bottiglie di vino bianco e rosso (20-30€) in serata.
30 marzo 2017,10,"Livello bassissimo,peggior Pandenus di Milano","Mi è sempre piaciuto il Pandenus,ma stasera,il personale non era all altezza del luogo. Ho ordinato due spritz, uno dei quali Saint Germain,IMBEVIBILI!!"
29 marzo 2017,10,Vergognoso,"Sono stato recentemente in questo locale per un aperitivo: - Buffet di basso livello, soprattutto la qualità - Personale maleducato - Mancanza di un listino prezzi completo e chiaro (Prezzi birre e bibite) - Prezzi bibite e birre completamente fuori dal mondo. Ho speso 9 Euro per una menabrea da 33 in bottiglia. Non ci tornerò mai più."
25 marzo 2017,50,Dovete andarci assolutamente!!!!!,"Volete bere un ottimo aperitivo in Milano??? Andateci in tutti i PANDENUS di Milano oltre ad avere un personale eccellente , L aperitivo e spaziale curato nei minimi particolari con una pizza buonissima è una varietà di buffet UNICA !!! Andateci!!!"
9 marzo 2017,30,"Metà sì, metà no","Sono stata in orario aperitivo e devo dire che il locale è carino anche se gli sgabelli son scomodissimi..Per mangiare c'è abbastanza scelta ma un po' povera, per quanto mi riguarda èun voto insufficiente..In alternativa si possono ordinare delle buone pizze fatte al momento da pagare a parte. Il personale è gentilissimo; il servizio, nel nostro caso, lento. I cocktail son molto buoni quindi, prendendo in considerazione tutto, il voto è sufficiente ma non eccelso, ecco...Tuttavia non lo escluderei come locale"
5 marzo 2017,40,Brunch della domenica,"Porzioni abbondanti e veloci nel servire. Il brunch della domenica consiste in 4 menù non modificabili se non nella cottura dell'uovo (strapazzato, occhio di bue, alla benedict o sodo) al costo di 25€/cad. il personale è gentile ed educato."
