8 agosto 2019,20,No,"Siamo stati con amici a fare il brunch una domenica mattina. Il locale carino ma niente di che. Il personale invece non ti sorride neanche se lo paghi. Poco gentili e poco accoglienti. Il brunch è molto sotto la norma, Infatti puoi prendere un piatto unico, e non c'è nemmeno il caffè incluso. In quattro abbiamo pagato €120 e mi sembra davvero un'esagerazione."
3 luglio 2019,10,Il servizio peggiore che ci sia,"Se vuoi prendere un caffè al volo, non venire quì. Se chiedi una centrifuga, ti conviene girare il bancone e fartela da sola. Confusione dietro il bancone, tutti fanno tutto, non esiste coordinazione. Cibo buono, ottimo marketing e devono baciare a terra solo per questo, fosse stato un altro bar sarebbe già chiuso da anni."
23 giugno 2019,30,Aperitivo velocd,"Per un aperitivo decidiamo di fermarci da Pandenus Mercato, locale che mi ha sempre attirato. Al nostro arrivo chiediamo un tavolo per due e, data la situazione al completo nel dehor esterno, eravamo ben consci che ci saremmo accomodati all’interno. Durante l’entrata ci offrono due shottini di Saint Germain, mossa sicuramente apprezzata. Una volta dentro noto liberarsi un tavolo da due persone e chiedo cortesemente al cameriere (forse gestore) se ci saremmo potuti spostare, il quale di tutta risposta ci dice che avrebbe verificato anche se “certo che se me lo chiedete tutti........”. Mi sarei aspettato una risposta, sia in caso affermativo che in caso negativo. Purtroppo, ad oggi, dopo qualche giorno, la risposta non è arrivata. Abbiamo consumato i nostri drink (buoni) ed abbiamo concluso il nostro aperitivo. Ah.....il tavolo all’esterno, alla nostra uscita, era ancora libero."
13 giugno 2019,30,"Si, ma...","Posto bello, lo spazio allestito all’esterno, appena fuori il cuore di Brera merita di essere visto. Ma è un locale non del tutto convincente. Buoni i cocktail, ricercati e particolari, ma venduti a caro prezzo. Inoltre il cocktail viene servito con una ciotolina di verdura, una di olive e 4 pezzi di pizza surgelata, l’aperitivo non è un buon punto di forza. Servizio con poca attenzione, i camerieri non ci hanno portato nemmeno i tovaglioli, sicuramente da migliorare."
7 giugno 2019,10,Cena disastrosa,"Prenoto, e preciso che ero cliente, con pochi amici cena, serata piovosa con pochissima gente nel locale, motivo per cui pensi di essere servito nel migliore dei modi. Invece tutto un disastro: disattenzione, poca cortesia e addirittura il direttore che pur presente non si accorge del mio malcontento e continua a nn vedere la mancanza di servizio.... fatto presente il fatto neppure le scuse si è ricordato di fare a me e ad i miei ospiti... per fortuna in Brera i locali sono tanti."
7 giugno 2019,20,Per turisti e fighetti,"Sono venuto in questo locale per qualche pranzo e aperitivo e, purtroppo, la mia impressione rimane sempre la stessa. Premessa, la cucina è davvero di qualità, e gli ingredienti sono ottimi e preparati davvero molto bene. Questo vale anche per la parte caffetteria, che offre proposte davvero ottime. Inoltre, il locale p molto carino ma... ...ci sono una serie di aspetti che mi hanno deluso. Il servizio, discreto in termini di approccio, è talvolta lentissimo e poco attento. I piatti, seppur di grande gusto, fanno pena per quantità. Infatti, qualsiasi cosa si ordini, arrivano delle mini-porzioni più da aperitivo che da pranzo. Prezzo, soprattutto in relazione alla quantità, direi a dir poco eccessivo. Inoltre, di recente sembrano aver ritoccato ancor i prezzi, diventando imbarazzanti su alcuni piatti (es. Insalata con Pollo o Polletto, che poi sono due cosce, con due patate 16€)...insomma, con meno di 18€ difficilmente mangi (senza caffè). Va bene tutto, la location e la zona, ma sempre in questo quartiere, anche solo a 100mt di raggio, si trovano locali molto più carini e soprattutto di maggiore qualità, ma con prezzi decisamente più bassi. Buono...ma anche no!"
1 giugno 2019,10,Poor experience!!!!!!,"Esperienza scioccante! Serviti con tempi biblici in un locale semivuoto, cortesia inesistente e prezzi esorbitanti! Vi dico solo: 12€ per uno shot di greygoose, amari caldi e senza ghiaccio. Da evitare assolutamente"
28 maggio 2019,30,Sconsigliato per aperitivo,"Il locale è molto carino e il personale attento ed educato. Purtroppo lo sconsiglio per l'aperitivo perché rispetto a tanti altri locali lo trovo caro e scarso. Abbiamo speso 21€ per due cocktail (di cui uno spritz) e le uniche cose che ci sono state servite da mangiare sono state una ciotolina con dei minuscoli pezzi di cetriolo e peperone, cinque olive (piccanti) e quattro pezzetti (due a testa) davvero piccoli di pizza bassa e secca. Piuttosto deludente."
11 maggio 2019,10,più inesistente aperitivo della città...,"seconda volta che mi succede una triste esperienza al Pandenus. Questo di via Mercato è il più triste aperitivo della zona (siamo nel cuore di Brera...). Non accettano prenotazioni e vabbeh. Locale vuoto, ci portano dei tranci di pizza sottile e rigida, quattro olive e via. Stop. Fine dell'aperitivo. Tutto io resto va ordinato. Servizio lento e impreciso. Tutto arriva sempre dopo il momento giusto. Una tristezza infinita. Volevamo fermarci anche a cena ma siamo fuggiti a gambe levate..."
14 aprile 2019,40,Pausa pranzo Fuorisalone,"Location molto curata e ricercata. Pausa pranzo con servizio eccellente, veloce e cortese il personale. Cibo di qualità con buona presentazione dei piatti. Unica pecca, il prezzo un pochino troppo alto."
14 aprile 2019,20,Locale ridicolo. Sovraprezzato rumoroso e mediocre nel cibo,"Brunch con amici. Premetto che sono sempre stato un grande amante del pandenus e della sua formula brunch. Adesso, cambiata formula, vergognoso. A parte aver speso 35 euro per mangiare due uova e due fette di salmone (+ 5 caffè e 2 bicchieri di vino in 5) che è un furto, il locale è rumorosissimo, freddo (e siamo ad aprile) e diciamocelo, cibo veramente dozzinale. Abbandonata la formula precedent edove il cibo era niente di speciale ma buono e abbondante, siamo passati alla formula “mangiare poco, pagare tanto”: i piatti si chiamano come prima e hanno gli stessi prezzi ma metà dei contenuti. In più non sono più menu, con relativi succhi e caffè incluso ma è tutto a parte. Una presa in giro. Meritano di fallire quanto prima"
3 aprile 2019,10,Servizio inesistente,"Tavolo di colleghe di lavoro, arriviamo scaglionate, primi cocktail ordinati alle 19.55 con la promessa di una pizza che ""è in forno, sarà pronta in 5 minuti"". Insieme al cocktail (buono, per carità) 3 olive e 2 carote in pizimonio. Niente pizza. Altri cocktail ordinati, cibo ordinato, secondo giro di bicchieri per tutte. Finalmente arriva la pizza. È passata più di un'ora. I piatti e i bicchieri vuoti rimangono sul tavolo fino a che non ce ne andiamo. Nessuno viene a chiederci nulla, nè se va tutto bene, nè se vogliamo altro, nè a portare via i vuoti. Al tavolo accanto, invece, evidentemente due ""amici di qualcuno"" arrivati oltre un'ora dopo di noi, 2 camerieri fissi. Andiamo via alle 22.10, nessuno, nemmeno alla cassa che ci chieda se è andato tutto bene. Abbiamo speso oltre 150 Euro per aperitivo. Il menu curato da uno Chef stellato è sufficiente a far provare il locale, ma se poi i clienti vengono trattati così non ci sono repeaters... non tornerò e sconsiglierò caldamente."
3 aprile 2019,10,Pessimo!!,"Stamattina sono andata da pandenus per fare una classica colazione,all'ingresso c'erano dei clienti già serviti così chiedo gentilmente alle 2 ragazze dietro al bancone se potessero farmi un cappuccino e che avevo un po d fretta. Alla mia richiesta una delle 2 fa una smorfia della serie ""col cavolo"" e io attendo ben 10 minuti per un cappuccino che nn è mai arrivato perchè dopo 10 minuti neanche nel posto più affollato ti fanno attendere così!Così ho detto alla ragazza di lasciar stare e me ne sono andata. Se nn avete voglia di fare questo lavoro che è a contatto con la gente cambiate mestiere!"
30 marzo 2019,10,Servizio pessimo e scortese,"Cameriere e responsabile di sala scortesi e incapaci di soddisfare le esigenze di noi clienti. Non sono nemmeno riusciti a farci sedere comodamente adducendo motici di disposizione delle sedie. Sconsigliato, non tornerò."
24 marzo 2019,40,Relax in via del Mercato,Colazioni super e staff gentilissimo ti fanno subito partire bene la giornata. Ottimo anche per pasti più completi! Qualità prezzo più che giusto!
17 marzo 2019,10,Pessimo aperitivo,"Volevo passare un piacevole aperitivo con un’amica e mangiare un po’ di buona pizza ma aperitivo deludente! Tu portanto una ciotola di olive, una di verdure e un piccolo pezzo di pizza.. pure ordinando un secondo giro da bere la pizza non l’hanno riportata! Abbiamo dovuto ordinarne una (peraltro sembrava surgelata) e abbiamo pagato molto rispetto al servizio e alla scarsa qualità! Sconsigliato"
1 marzo 2019,50,GARANZIA ASSOLUTA,"Ho già recensito questo locale qualche mese fa e lo frequento da tempo, ogni volta che mi è possibile, per colazione e aperitivo; oggi mi sono fermato 2 minuti per un semplice caffè al banco e sono rimasto felicemente sorpreso... ragazzi, alle 13.30 di un comunissimo venerdi di Marzo non c'era un posto a sedere libero, nè dentro nè tantomeno fuori!! Questa è la conferma di quanto avevo già detto; la serietà, la professionalità e la simpatia di tutto il personale, uniti alla qualità di tutto quello che si ordina, significano solo una cosa: di meglio non ce n'è, parola dello Zio Alessio!!"
24 febbraio 2019,50,Una bella colazione,"Sveglia a Brera è di per sé un bel vedere ma con una bella giornata di sole alzarsi fare una passeggiata e fermarsi da Pandenus in via mercato ha un suo perché.Il locale è di stile francese con personale molto afabile , possibilità di sedersi sia dentro che fuori e grande assortimento di dolce e salato di ottima qualità ,davvero un gran bell'inizio di giornata"
28 gennaio 2019,10,Sconsigliato,"Locale molto alla moda e con grande potenziale, purtroppo non all’altezza delle aspettative. Doveva essere un tranquillo “brunch” domenicale ma tra il servizio molto disattento e la qualità scarsa abbiamo solo cercato di scappare il prima possibile. Inoltre viene proposta la formula “brunch” che però non comprende nulla di quello che solitamente viene offerto in altri posti ( es. caffe/spremuta ) ; costa meno ma allora non ha senso indicarlo come brunch. Non lo consiglio."
25 gennaio 2019,20,Stipsi ostinata,"Locale molto modaiolo, arredo carino, cocktail buoni. Aperitivo a dir poco squallido e stitico: i cocktail costano 12€. L’offerta di cibo è INESISTENTE. Portano al massimo due rettangolini di pizza, due olive e una ciotolina di pinzimonio per persona. Se non proponi un buffet, il prezzo dei cocktail dovrebbe essere più bassino. Servizio mediocre. Col cameriere che fa fatica a parlare, pure per confermare di aver sentito e capito l’ordinazione. Per inciso, se mi fai da mangiare, magari ordino due cocktail, altrimenti, per noi ubriacarmi, mi devo contenere. Se non riordini i cocktail, non ti portano nulla di mangiare. La cosa più bella del locale???? Il cesso, puro studio di design d’intenti. State alla larga."
25 gennaio 2019,50,Il meglio che si possa chiedere!!,"Frequento questo locala da diversi mesi, a colazione e per degli aperitivi... sono a Milano da quasi 15 anni e posso dire, senza ombra di dubbio, che questo è il miglior locale mai provato a Milano!! È il Primark dei bar, ci si trova di tutto, dalla frutta ai panini, dai cornetti a fino ad arrivare alla pasta... locale curatissimo ed accogliente, la simpatia del personale nel trattarti come uno di casa, Mirko e Stefano in testa, lo rendono il miglior locale di tutta Milano!!"
20 gennaio 2019,20,MEH,"Tipico esempio di locale fighetto con poca sostanza. Brunch della domenica: poche proposte non particolarmente entusiasmanti. Nel mio piatto, composto da uova, pancetta e salsiccia, quest'ultima era fredda. Non viene portato, come di solito avviene nei brunch, caffè o succo (a meno che, ovviamente, non lo si ordini a parte), non c'è una proposta che ricomprenda sia dolce sia salato, anche questo elemento direi essenziale di un brunch, Prezzi abbastanza crazy, un estratto 8 euro mi pare decisamente una presa in giro. Nel complesse se ne può anche fare a meno ecco."
6 gennaio 2019,20,"Qualità buona, servizio meno","Sono stato nel locale con amici. Ci hanno messo fretta ripetendoci più volte che il tavolo era prenotato senza che però poi si sia fatto vivo alcuno. A parte questo, che comunque è legittimo, per il servizio solo un cameriere è stato accogliente, gli altri pessimi, davvero,mi dispiace essere negativo ma sicuro nn ci tornerò. Buono il caffè e le tisane. Nn fate aperitivo perché nn si mangia. Il locale tutto sommato ha una bella atmosfera."
6 gennaio 2019,50,Locale che merita,"Nella grande offerta milanese ormai decisamente europea e globale questo è un locale interessante Moderno ma caldo e accogliente Molto pulito e ordinato, non è sempre scontato Personale cordiale, premuroso ma professionale Colazioni con caffè e tutto il resto a posto, lunch con piatti del giorno fatti espressi molto buoni (pasta al ragù, cous cous, insalate ricche) Aperitivo che vale, con stuzzichini espressi Porzioni normali/light ma non siamo in trattoria Prezzo adeguato a Milano e Brera e quindi non popolari, ma giusto per il cibo e il contesto"
15 dicembre 2018,50,Bellissima sorpresa,"Una bellissima sorpresa,è stato un aperitivo ricco di pizza e club sandwiches,bella gente,ambiente molto bello e servizio ineccepibile. Tornerò sicuramente"
5 dicembre 2018,30,Troppo caro,"Sembra non esserci limite al prezzo di un aperitivo. A Milano, dico. Il locale è carino, con i limiti del vecchio e mai abbastanza compianto Resentin: due stanze lunghe e strette dove è difficile muoversi e un minuscolo spazio all’aperto. Ma 12 euro per un bicchierino di un aperitivo qualunque è decisamente un prezzo che reputo eccessivo e che sono sicuro di non voler pagare. In più, diversamente da altri locali della medesima insegna, non c’è cibo di accompagnamento se non qualche fettina di pizza portata al tavolo e un paio di verdurine in pinzimonio. Tutto deve avere un equilibrio."
20 novembre 2018,40,Una bella scoperta,"Quello che appare da fuori come un semplice bar si è dimostrato un ristorante coi fiocchi. Ho potuto assaggiare una ottima cotoletta alla milanese e un buonissimo dessert. Personale gentilissimo e gioviale. Unica pecca, se vogliamo dire così, gli spazi un po’ angusti (fare entrare tre piatti di cotolette su un tavolino non è stato semplicissimo) ma il giudizio è positivissimo."
11 novembre 2018,40,Una garanzia!,"Sono stata spesso al Pandenus di via mercato sia per la colazione che per il pranzo. Mi sono trovata sempre particolarmente bene. Bella la location, staff attento, gentile, sorridente, dei veri professionisti. La domenica a pranzo é un po’ caotica perché il locale è sempre pieno, quindi consiglio di prenotare sempre e di scegliere come fascia oraria quella delle 14, 14:30, quando c’è un po’ meno gente. In ogni caso questo posto è una garanzia ed è sempre un piacere tornarci! Bravi."
9 novembre 2018,40,Risotto alla milanese,"Passeggiando per Brera ho avuto il piacere di notare questo posticino carino e molto accogliente. Io e la mia amica abbiamo preso un delizioso risotto alla milanese con ossobuco, ma abbastanza caro per essere un piatto così piccolo. Il servizio è stato ottimo, tutti molto gentili, specialmente la ragazza pugliese che ci ha servite. Unica pecca il fatto che ci abbiano chiesto di andare via poco dopo aver mangiato."
7 novembre 2018,40,Caffettino,Bella location personale gentilissimo per un caffè al tavolo con amica in compagnia di una cake deliziosa alla frutta. Sono stata molto volentieri ci ritorno per pranzo (ho visto dei piatti molto invitanti )lo consiglio 😋
31 ottobre 2018,20,Servizio scarso,"Sono stata in questo locale per un aperitivo. 1. Avevamo prenotato e ci avevano riservato tre tavoli; io sono arrivata in anticipo e un tavolo dei nostri era anche ""giustamente"" occupato, ma, all'arrivo degli altri ospiti, non è stato comunque liberato. 2. Avevamo una persona tra noi allergica ai latticini, perciò abbiamo chiesto se fosse possibile avere una pizza rossa e ci è stato risposto che c'era una fetta senza mozzarella nel tagliere (parte della crosta evidentemente); per fortuna su nostra insistenza ne hanno portata una senza formaggio. 3. In generale servizio molto lento e poco organizzato."
18 ottobre 2018,50,Delizioso,"Sono stata qui a cena con amiche! Il locale è veramente carino, curato nei dettagli e l’atmosfera è favolosa. I camerieri sono simpatici, gentili e disponibili. Ho mangiato una pasta alla carbonara originale e squisita!!! Ma il top è stato il dessert... veramente delizioso!A tutti gli amanti del cioccolato: dovete assolutamente provare la mousse di cioccolato venezuelano con al centro la pallina di gelato. E la porzione era abbondantissima! Prezzi giusti. Tornerò di sicuro!"
14 ottobre 2018,10,Da evitare proprio,"Sono stata questa domenica per un brunch tra amici. Il servizio praticamente inesistente, i camerieri spariti del salone, 15 min per riuscire a ordinare una coca zero, che nn stata mai portata pero è stata addebitato sul conto. Tranne tutto, il cibo mediocre, per nn dire altro. Per una citta come Milano, queste è inaccettabile."
16 settembre 2018,50,"In pieno centro, atmosfera rilassante. Ottimi drink","Atmosfera rilassante, in pieno centro. Il barman è molto simpatico e sa fare ottimi drink, anche analcolici per chi come me non beve molto alcol. Siamo rimasti soddisfatti. Magari un po' più di cibo non guasterebbe, ma la pizza e le olive sono davvero ottime"
8 agosto 2018,30,Pausa pranzo,"Locale conosciuto in zona brera. Perfetto per una pausa pranzo veloce. Buoni i panini ma anche i piatti, anche se non molto abbondanti. Pane e pizza molto buoni. Conto medio alto per quello che si mangia"
26 luglio 2018,40,buono,"Sono stata a pranzo con amici. Il locale ha posti all'aperto all'ombra e all'interno, il servizio è stato veloce e il personale molto gentile. Ho assaggiato un ottimo hamburger e chi era con me ha mangiato una buona tartare di salmone con avocado e buon curry di pollo. Credo che se ne avremo occasione ritorneremo. Bravi"
20 luglio 2018,50,"Belle location, ottimo cibo e personale molto gentile!","Trovo molto belli ed eleganti i ristoranti di Melzi d'eril, largo la Foppa e via mercato. Il cibo è buono e di qualità e in particolare trovo molto buoni i dolci. Ottimo per colazione e aperitivo! Consigliatissimo! Staff del negozio di via mercato super gentile!"
23 giugno 2018,20,"Servizio basso, cibo scarso","Mangiato qui x un pranzo veloce. Ho trovato il servizio abbastanza scadente (mi è arrivato il piatto e non mi avevano nemmeno apparecchiato, ho dovuto chiedere 2 volte il cestino del pane che mi arrivato praticamente a pasto ultimato mentre ai tavoli intorno a me è stato correttamente portato insieme alle bevande). Il cibo è medio basso e colpisce molto il fatto che il pane sia davvero tremendo, vecchio e gommoso. Ciliegina sulla torta: È CARO!!!!!! Davvero tanto. E senza motivo. Consiglio: Fate due passi ed entrate nel locale adiacente. Non c'è paragone."
19 giugno 2018,40,Brunch,"Buon brunch, ma decisamente caro, soprattutto il coperto e le bevande, personale gentile, posto carino."
13 giugno 2018,40,Buono ma servizio lento,"Ho deciso di provare questo posto per pranzo. Servizio leggermente lento, abbiamo aspettato circa 20 min per avere un insalata greca e un club sandwich. Entrambi molto buoni. Prezzi nella media di Brera."
31 maggio 2018,30,Modaiolo e caro,"Là dove c’era lo storico Resentin, ora c’è l’ennesimo Pandenus, che non ha modificato sostanzialmente la struttura del precedente locale, che però ora ha un’aria più modaiola e “trendy”. Il menu non è male ma, nonostante i nomi creativi (e un po’ irritanti) attribuiti ai piatti, non presenta particolari lampi di genio, a fronte di prezzi decisamente sostenuti. Io e la mia compagna abbiamo provato un secondo piatto ciascuno: “Temp-hour” (=fritto di calamari e verdure), di qualità media, e “Il mare d’estate”, alias dentice al forno “servito con verdure d’estate” (così recitava il menu): il pesce era buono, ma le verdure erano zucchine, carote, broccoli e cavolfiori (mi sarei aspettato qualcosa di più “estivo”). I due piatti costano rispettivamente 22 e 24 euro: aggiungendone 3 di coperto, 10 (dieci!) per un gelato con 3 lamponi, 7 e 9 per due calici di vino si spendono 40/50 euro a testa per una mezza cena che non vale la cifra, anche se ci troviamo in piena zona Brera. Il servizio peraltro è cortese ed efficiente."
27 maggio 2018,30,"locale molto carino, cibo buono, prezzi alti","Siamo andati oggi per un brunch, prima visita. Il posto e' molto carino e dispone di tavoli all'aperto. Peccato che non abbiano aperto la tenda per riparare dal sole. Ad un certo si stava troppo caldi, ma fortunatamente stavamo per finire. cibo buono, nulla di ricercato o particolare. prezzi alti."
7 maggio 2018,20,"Personale lento e scortese, prezzi ben sopra la media","Scelto il locale per un aperitivo, siamo 5 ragazze tra i 26-28 anni. Ci sediamo in 3 e iniziamo ad ordinare visto che le altre sono in ritardo. Ordiniamo 2 cocktails e un bicchiere di vino. Ci portano un piccolo tagliere con delle fettine di pizza, qualche polpetta e olive (ben diverso trattamento dal Pandenus in Moscova che conosciamo bene) ma non è un problema, se avremo ancora fame ordineremo altro a pagamento, ci diciamo. Arrivano le altre 2 che ordinano altro e decidiamo di prendere un piatto da mangiare insieme, la cameriera è molto scortese (sinceramente non ne capiamo il motivo) comunque ordiniamo altro cibo, in 30 minuti ordiniamo altri cocktails come secondo giro. I drink arrivano dopo mezz’ora, sempre nella più grande arroganza della cameriera, che ci tratta come se stessimo elemosinando qualcosa. Questo comportamento, ingiustificabile in qualsiasi circostanza, avrebbe almeno il minimo senso se, a locale stracolmo, noi avessimo occupando un tavolo senza consumare, ma per tutto il tempo noi ordiniamo nuovi drink e per altro il locale ha ancora qualche tavolo vuoto (è lunedì). Decidiamo di alzarci, parte il conto assurdo su cui sorvolerò, il finale ancora più assurdo arriva in cassa. Ovviamente chiediamo di pagare separatamente, non mi sembra una cosa tanto strana dividere il conto, e comunichiamo già noi la cifra precisa al cassiere, che deve quindi solo scalare dal totale mano a mano. Prima si inizia a lamentare perché non ha banconote da 5 e 10 € per dare i resti, decidiamo quindi di pagare con la carta per sorvolare il problema, lui chiama la simpaticissima cameriera che già ci aveva tanto amate durante l’aperitivo, che ci chiede scocciata se tutte avremmo pagato con la carta (cosa che alcune di noi avrebbero evitato se loro avessero avuto i resti). Proviamo a spiegarci e veniamo ignorare completamente, comunichiamo ognuna comunica la cifra da pagare arrivato il suo turno e continuano a sbagliare, tanto che ad un certo punto mi chiedo se ci siano dei problemi di acustica o di udito dietro al bancone.  Di sicuro non torneremo, trattate con arroganza e supponenza dalla cameriera, abbiamo speso quanto una cena, senza mangiare praticamente nulla e considerando anche che una di noi non ha bevuto nemmeno alcolici perchè incinta. Il tutto aspettando tempi biblici senza giustificazioni. No comment."
24 aprile 2018,40,Tartare perfette.,"Locale molto aggiornato per menu food e beverage. Piatti curati con materie prime d'eccellenza. Cacio e pepe rivisitato molto gustoso e tartara di manzo unica a livello dei migliori stellati. Miscelati ben fatti e servizio professionale tenuto conto l'alto livello di prenotazioni e di affluenza al banco bar, ben fornito e curato. Nel centro di Milano, la percezione di prodotti artigianali non è comune."
17 aprile 2018,10,INCAPACI ..... troppo lenti poco personale perfetto per chi ha tempo da perdere,"Purtroppo questo era un locale milanese molto ben gestito Ora é diventato Pandeus Peccato é una grande auto .senza motore!,,, Che tristezza Auguri speriamo che migliorerete Fino ad oggi ...... Nulla,!!!!!"
4 aprile 2018,40,“Buono ma small”,"Ristorante carino, molto alla mano, sulla linea del Bistrot classico, tovaglietta usa e getta (come ormai si usa ovunque), coperto modesto, luogo accogliente, staff giovane e cordiale. Unica pecca, piatti small. Avrei pagato due euro in più per un pezzetto di focaccia piu grosso, piuttosto che andar via non del tutto sazia! Per il resto tutto benissimo!"
2 aprile 2018,10,Cattiva educazione,"Personale molto scorretto, professionalità latente, cura del cliente del tutto assente. Assicuratevi di avere lo stesso concetto di tempo della responsabile di sala. I suoi ""dieci minuti di attesa"", sulla terra equivalgono a circa un'ora e un quarto di attesa. Da evitare nel modo più assoluto."
2 aprile 2018,50,Eleganza e cortesia,"Una piacevole ed ormai abitudinaria sosta caffè del sabato mattina. L’ambiente è molto raffinato, giovane e la cortesia e l’educazione del personale fanno da padrone. Simpatico punto d’incontro tra amici. Da provare!"
