1 aprile 2018,20,Non ci siamo... Non torneremo. Solo per turisti (non italiani) che hanno fretta.,"Saro' breve: cibo mediocre e porzioni normo-piccole. Pizza surgelata (e mini porzione), insalata di avocado con pezzetti di avocado contati e veramente misera. Patate che accompagnano l'hamburger (troppo crudo dentro) scarse e comunque troppo unte. Camerieri troppo indaffarati per far retta...Abbiamo mangiato in fretta e siamo scappati (oltre 40 euro in 3 per aver mangiato poco e male). Con tutti i posticini buoni che ci sono a Milano, non credo torneremo piú."
30 marzo 2018,10,Camerieri che fuggono e fanno scappare i clienti,Scordatevi un tranquillo lunch! Questo posto ha i prezzi di un ristorante e il servizio della Stazione Centrale all’ ora di punta . Ti fanno aspettare 1/2 ora prima di venire a prendere L’ ordinazione . Ti fanno un ‘ insalata all’ avocado che in realtà è a base di cetriolo . Sbuffano se chiedi loro qualcosa ... in più brutta musica di sottofondo con rumore infernale con tavolini vicini che più vicino non si può ! Morale ; siamo scappati dolo L’ insalata come fanno loro quando ordini un caffè ; non ti ascoltano perché sono occupati a sparecchiare . Hanno bisogno almeno di 4 camerieri in più visto L’ afflusso di ragazzini schiamazzanti !
25 marzo 2018,50,Bravissimi!,"Bel locale, menu molto interessante, ma soprattutto personale molto molto affabile e attento. Primi fra tutti Giuseppe, perfetto, Tiziano, molto molto gentile. Cocktail ottimi, stuzzichini buonissimi, pizza davvero buona. La prima impressione è davvero ottima, perché quando entri in un locale e ti salutano con estrema affabilità, come se ti conoscessero da sempre, scalda il cuore."
19 marzo 2018,50,Impeccabile,"Frequento Pandenus già da tempo, di solito quello in Risorgimento, ma domenica sera ho deciso di provare questo in Mercato incuriosita dalla collaborazione con lo chef Enrico Bartolini. Ingredienti di prima qualità e materie prime trattate in un modo impeccabile, ogni piatto era perfettamente equilibrato, cottura della carne perfetta, personale attento al servizio e professionale ma al tempo stesso alla mano e simpatico, disponibili anche nei confronti di cani, hanno portato subito l’acqua al mio cane appena l’ho chiesta e raramente se ne ricordano a Milano. Atmosfera curata e accogliente. Unica pecca il volume della musica un po’ troppo alto per i miei gusti. Ci tornerò sicuramente e lo consiglio vivamente a chiunque essendo adatto a qualsiasi fascia d’età. Complimenti ragazzi!"
14 marzo 2018,10,Aperitivo,"Aperitivo annacquato, pochissimo spazio, servizio lentissimo e respingente, salatini scarsi (due polpettine e 3 olive in 5) personale poco cordiale e risposte di cattivo gusto. Peccato perché il posto sarebbe molto carino ma cosi facendo fanno solo rimpiangere la vecchia gestione."
11 marzo 2018,40,sfizioso,"Sono stata in questo locale per il pranzo della domenica con degli amici. locale molto carino e curato, menù vario e ricercato adatto a tutti i gusti. Molto caotico, abbiamo aspettato un po prima di poter ordinare ma perché il locale stava per esplodere. È necessario prenotare perlomeno la domenica! Prezzi un po altini ma nella media di milano. tutto sommato molto buono."
10 marzo 2018,40,"Molto buono, ma potrebbe di più","Locale molto carino in centro a Milano, ha un ottimo servizio, una cantina sufficiente, cibo buono, ma certamente va ricordato per il pane e per i dolci. Ambiente confortevole e prezzi un po più alti della media, ma va bene così."
5 marzo 2018,40,Aperitivo raffinato,"Alle porte di Brera, il Pandenus piccolo è ricercato, si distingue per l'atmosfera charmant e per i cocktail raffinati e particolari. Sconsigliato a chi preferisce le abbuffate dell' happy hours poiché viene portato un piccolo piatto di olive, polpettine e pizzette, che seppur delizioso, non soddisfa l'appetito. Si possono però ordinare delle pizze molto buone da far tagliare a spicchi e condividere con gli amici. I prezzi sono in linea con la zona, 2 giri di cocktails per quattro persone e 2 pizze per un totale di 120€"
3 marzo 2018,50,Pazzesco !,"Ci sono stato oggi , a pranzo invitato da amici . C’è ne sono 5 a Milano . Locale glamour . Si può mamgiare di tutto e tutto delizioso . Una varietà di scelta unica dalla colazione in poi . Mirko il Restaurant Manager ci ha trattato molto bene . E’ un bellissimo posto . Giovanile , rilassato . Sfizioso . Insomma dovete provarlo !!!!"
1 marzo 2018,50,Stupendo!,"Bel locale. Arredato con gusto e curato nei minimi particolari. Vado a pranzo in settimana con i colleghi e a volte durante il week-end. Sempre tutto perfetto. Cibo buono e staff spettacolare. Sempre simpatici, professionali ed attenti. Bravi."
26 febbraio 2018,40,Una garanzia!,"Sono stata da Pandenus diverse volte, sia a colazione che a pranzo e mi sono sempre trovata bene. Il personale è molto gentile, tutti educati e sorridenti. Sono professionisti del settore e si vede. Location molto bella, soprattutto il tavolo vicino alla vetrata. Questa sera ho provato anche l’aperitivo, fanno dei cocktail molto particolari, io ho provato il Saint Barth, notevole! Portano dei piccolissimi assaggi (olive, polpette..), quindi noi abbiamo ordinato 2 pizze di accompagnamento, buono l’impasto, giusta la cottura. È un posto perfetto quindi per ogni situazione, chiaramente bisogna avere l’accuratezza di prenotare perché è molto frequentato e, come tutti i posti molto frequentati, bisogna avere la pazienza di aspettare qualche minuto in più per avere l’ordinazione, ma ne vale assolutamente la pena! Nota molto positiva: arrivano al tavolo con tutte le ordinazioni fatte, non come in certi posti che quando uno inizia l’altro ha già finito! E soprattutto quando vai via ti chiedono come ti sei trovato e ti salutano con un bel sorriso, BRAVI!!"
27 gennaio 2018,50,Impeccabile,Sono stato a fare la colazione in questo posto l’altro giorno e devo dire che non immaginavo di essere accolto come se fossi a casa. Oltre la qualità dei prodotti davvero notevole la gentilezza dei ragazzi dietro il bancone. Ottimo!
26 gennaio 2018,50,Bella scoperta,"Sono stato qui con alcuni amici, ci siamo trovati molto bene sia a colazione che a pranzo. Abbiamo avuto sempre un'ottima accoglienza ed il personale è stato molto gentile ed ospitale. Che dire, se siete nella zona sia per una colazione e sia per un pranzo veloce e buono lo consiglio."
26 gennaio 2018,50,Rivelazione!!,"Io davvero non capisco come le persone possano dire che il servizio è sgradevole, io e miei colleghi abbiamo organizzato un pranzo aziendale e siamo rimasti più che soddisfatti, cibo e vino ottimi, degni di una fascia medio alta a Milano"
25 gennaio 2018,50,Perfetto,"Come far partire meglio la giornata? Accoglienza fantastica! La colazione è un momento molto importante della giornata, un momento in cui tutto deve essere assolutamente perfetto per concentrarsi e fare un piano nella propria testa prima di entrare a lavoro. Si parte dal piacevole odore fino alla qualità dei prodotti che non deludono mai! Ma quello che mi ha stupito di più è la gentilezza del personale e questo credo sia fondamentale. Avanti cosi!"
24 gennaio 2018,50,Da provare!,"Il titolo...parla da solo. Personale accogliente, attenzione al dettaglio e costi perfettamente in linea con il contesto in cui si inserisce il locale. Insomma...nulla da eccepire. Complimenti!"
22 gennaio 2018,10,Mai più,"Alle 11,00 aperitivo in tre una ha preso latte macchiato e brioche noi due 2 bicchieri di vino a testa come aperitivo non sono arrivate ne patatine ne olive o salatini...abbiamo chiesto qualcosa di accompagnamento e sono arrivate due mini pizzette....posso capire che non è orario di happy hour ma allora non fatelo pagare come se lo fosse!! Il vino poi un normalissimo prosecco da 6 euro a bottiglia...un furto!!"
18 gennaio 2018,50,Come a casa!,"Semplicemente la colazione perfetta. Location, cibo e caffè...forse il migliore mai bevuto. Una menzione particolare va all'accoglienza e al servizio che fa fare il salto di qualità al locale."
16 gennaio 2018,40,Una gradita sorpresa,"Prima volta in questo locale mi ha subito colpito dall'esterno in più il ""Buongiorno"" all'entrata mi ha definitivamente convinto a provarlo. Pur essendo un po' scettico sul piatto di pesce consigliato dal cameriere l'ho voluto provare e il polipo alla piastra mi ha decisamente sorpreso sia per sapore che per come veniva presentato nel piatto. Nel complesso location molto curata e personale attento e cordiale. Ci ritornerò sicuramente per sorprendermi ancora."
13 gennaio 2018,10,Servizio vergognoso,"Dopo piu’ di 20 minuti non eravamo ancora riusciti ad ordinare, con camerieri che abilmente schivavano i nostri sguardi e i nostri cenni"
21 ottobre 2019,10,Peggior servizio bar a Milano,"Siamo arrivati in questo bar perché la terrazza sembrava carina e aveva alcuni riscaldatori. Ci siamo seduti alle 5. 35 pm. C'era un'altra coppia sulla terrazza.  All'interno del bar c'era un barista che lavorava e c'era un altro cameriere che spostava dei mobili sul bancone.  Poco dopo il nostro arrivo arrivò un altro tavolo e si sedette. Dopo circa 10 minuti mi chiedevo se fosse il servizio al tavolo dato che nessuno ci aveva servito. Mi alzai e andai al bar, così come un membro dell'altro tavolo per fare la stessa domanda.  Il barista dietro il bancone era abbastanza sprezzante nei nostri confronti e disse che qualcuno sarebbe finito. Ci ha guardato con la faccia di ""aspetta solo tu"". Il barista continuò a lavare i piatti e a metterli via. Non è come se stesse servendo molte persone. Chiaramente non era suo compito servire i clienti! !  Andammo a sederci di nuovo. 2 o 3 minuti dopo l'altro tavolo ha ricevuto alcuni menu dall'attesa che stava installando qualcosa. Non l'abbiamo fatto, ma non eravamo disturbati perché sapevamo cosa volevamo bere.   5 minuti dopo e iniziando a diventare impazienti abbiamo potuto attirare l'attenzione dei camerieri e abbiamo chiesto se potevamo ordinare, ha chiesto se volevamo i menu, abbiamo detto di no e gli abbiamo prontamente detto il nostro piccolo ordine di un caffè, un amaro e uno spritz.  Ci sono voluti 30 minuti per prendere un drink. L'amaretto e lo spritz furono consegnati da un nuovo cameriere, stavamo per uscire quando arrivarono. Mio marito ha chiesto del suo caffè e gli è stato detto che stava arrivando.  Il caffè non è arrivato, quindi abbiamo chiesto all'altro cameriere dove fosse il caffè e ci hanno detto che avevano chiuso la macchina del caffè e ci hanno detto che. Ehm, no, non ci è stato detto. Mio marito si è affermato e alla fine il caffè è stato portato.  Il bar è un bel bar e le bevande sono buone ma il servizio è terribile. Per finire, ci hanno fatto pagare 17 euro. Presumo che questo fosse il prezzo dell'aperitivo ma non c'era nessun aperitivo in offerta. Presumo che questo sia ciò che stavano creando a danno dei loro clienti.  Non consiglierei qui se si desidera un buon servizio o un drink a prezzi ragionevoli."
